{
  "created_at": "2026-04-22T00:00:00Z",
  "evidence_refs": [
    "generated/multi_office_train_clean_flow/release_train.json"
  ],
  "id": "office_handoff_packet_v1_example",
  "kind": "office_handoff_packet_v1",
  "notes": "Example artifact for office_handoff_packet_v1.",
  "owner_repo": "aoa-routing",
  "receipt_required": true,
  "source_office": "concierge.assistant",
  "state": {
    "intent": "install service mesh"
  },
  "status": "draft",
  "target_office": "courier.assistant",
  "version": "1.1.0"
}